web-scraper-order,web-scraper-start-url,item,item-href,Name,Price,MtTot,MtUtil,Bdroom,Bath,Parking,Description,PriceUnit,Province,PropertyType,PropertyState,PublishedDate,pages,pages-href
"1594171727-719","https://www.portalinmobiliario.com/venta/casa/mas-de-3-dormitorios/vitacura-metropolitana/_OrderId_BEGINS*DESC_PriceRange_4000CLF-7000CLF_PARKING*LOTS_1-*_TOTAL*AREA_100m%C2%B2-*","","","Casas en Venta en Vitacura, 3 dormitorios o más","","","","","","","","","","","","","null",""
"1594171729-720","https://www.portalinmobiliario.com/venta/casa/mas-de-3-dormitorios/vitacura-metropolitana/_OrderId_BEGINS*DESC_PriceRange_4000CLF-7000CLF_PARKING*LOTS_1-*_TOTAL*AREA_100m%C2%B2-*","$ 199.999.000","https://www.portalinmobiliario.com/venta/casa/vitacura-metropolitana/5633501-la-aurora-1785-uda#position=1&type=item&tracking_id=7a179f42-d429-4d20-9e55-a969f854cdc1","Casas en Venta en Vitacura, 3 dormitorios o más","199.999.000","125 m²","77 m²","3","2","2","Descripción
			
			
			
	

	

	
	
		Casa de 2 pisos buen estado, excelente ubicación, a pasos de Av. Vitacura, cercana a comercio, movilización, clínicas, colegios, en pasaje cerrado con conserje, portero eléctrico y portón automático. Distribución: Hall de entrada, living comedor separado, baño de visita completo, cocina equipada, loggia con patio interior, más pieza de servicio con baño completo. 
Segundo piso: Dormitorio principal con closet, más 2 dormitorios con closet, y un baño completo.
2 estacionamientos, antejardín y patio trasero con terraza y quincho.

VENDE DUEÑO. Contacto: macathieme@gmail. com; whatsapp: +56975242125","$","null","Casas","Propiedades usadas","27-06-2020","",""
