web-scraper-order,web-scraper-start-url,item,item-href,FullPrice,MtTot,MtUtil,Bdroom,Bath,Description,PriceUnit,WebDesc,PublishedDate
"1594173820-925","https://www.toctoc.com/Venta/casa/metropolitana/providencia?dormitoriodesde=3&dormitoriohasta=5&banosdesde=0&banoshasta=5&superficeDesde=100&superficiehasta=&moneda=2&preciodesde=4000&preciohasta=7000&ordenarpor=recientes&cargarmas=1&tipoOperacion=-1","ProvidenciaSalvador Donoso, en Zona Tipica de BellavistaCasa - Usado en venta 7  1  125 m²","https://www.toctoc.com/propiedades/compracorredorasr/casa/providencia/salvador-donoso-en-zona-tipica-de-bellavista/1456965?o=resultado_lista_seo_info","UF  6.500","0 m²","125 m²","7","1","Casa en Zona Típica de Bellavista, en barrio consolidado. Excelente ubicación, Salvador Donoso, cercano a Av. Bellavista y a todo el comercio del sector, clínicas, colegios, locomoción colectiva, etc.
La casa tiene una antigüedad de aproximadamente 88 años y tiene 125m2 construido, que no está regularizado.
Orientación Nor Oriente.
La casa cuenta con 7 talleres de pintura, 4 talleres en el primer piso y 3 talleres en el segundo piso o altillo.
Tiene una cocina, un baño y un patio interior al cual convergen todas las salas de talleres. La casa es de adobe con estructura de madera, con tabiques interiores tipo vulcanita. Está en buen estado de conservación. En las salas de talleres el piso es de madera, cerámica en cocina y baños. Ventanas con marcos de madera originales.
El Consejo de Monumentos Nacionales será responsable de supervisar cualquier proyecto de intervención en la casa para obtener el permiso de la Dirección de Obras Municipales, cuando corresponda.
La casa no cuenta con estacionamiento ni bodega.","UF  6.500","Casa en Venta Usado Providencia - Metropolitana Ver ubicación","09-04-2020"
"1594173815-924","https://www.toctoc.com/Venta/casa/metropolitana/providencia?dormitoriodesde=3&dormitoriohasta=5&banosdesde=0&banoshasta=5&superficeDesde=100&superficiehasta=&moneda=2&preciodesde=4000&preciohasta=7000&ordenarpor=recientes&cargarmas=1&tipoOperacion=-1","ProvidenciaSalvador DonosoCasa - Usado en venta 8  1  130 m² 130 m²","https://www.toctoc.com/propiedades/compracorredorasr/casa/providencia/salvador-donoso/1367400?o=resultado_lista_seo_info","$  185.000.000","0 m²","130 m²","8","1","Hermosa casa en Barrio Bellavista, Providencia. A pasos de Clínica Santa María  - Bellavista, en Zona Típica, Monumento Histórico; actualmente arrendada para talleres. Consta de 8 amplias habitaciones o talleres, baño, cocina, segundo piso donde se encuentran 3 habitaciones, las restantes 5 están en el primer piso.Patio interior de acceso con arboles y sombra, donde convergen los talleres. Muy buena rentabilidad actual e inversión a futuro.Muy buen estado de conservación y mantención.Muy buena conectividad.Excelente potencial para renta y vivienda.Actualmente se encuentra arrendada por talleres (app $ 900.000.- /mes) y el contrato vence en Abril 2020, por lo que se podrían seguir percibiendo las actuales rentas.Se escuchan ofertas razonables.","$  185.000.000","Casa en Venta Usado Providencia - Metropolitana Ver ubicación","29-11-2019"
