Srce,Province,PublishedDate,PropertyType,PropertyState,MtTot,Bdroom,Bath,Parking,PriceUF,Link,Description
"chile propiedades","Nunoa","TBD","Aparment","TBD","102 m²","3","2","TBD","199.000.000 CLP","https://chilepropiedades.cl/ver-publicacion/venta-usada/nunoa/departamento/avenida-sucre/3553641","A pasos del Hospital de Carabineros Lindas vistas departamento en una zona residencial de Ñuñoa con buena conectividad. Edificio de la Constructora "Almagro" Piso: 12 Orientación Nor/oriente Hall de entrada 3 dormitorios 2 baños El dormitorio principal en suite Living - comedor juntos con piso flotante y salida a terraza. Cocina equipada Todas las ventanas con termopanel Calefacción por loza radiante Logia 1 estacionamiento 1 bodega El edificio cuenta con: Piscina 2 Salones de Eventos Gimnasio Lavandería Accesos controlados las 24 hrs. Cámaras de seguridad Buena conectividada pasos de Antonio Varas y de Manuel Montt. Al lado del Hospital de Carabineros En la esquina un Strip Center"
"chile propiedades","Nunoa","TBD","Aparment","TBD","100 m²","4","2","TBD","115.000.000 CLP","https://chilepropiedades.cl/ver-publicacion/venta-usada/nunoa/departamento/socrates-con-pericles/3529772","Se vende amplio departamento de 100 metros muy bien ubicado en Villa Olimpica. Cuenta con 4 dormitorios uno en el primer piso y los otros tres en el segundo piso. Living comedor con acceso a balcón cocina americana amoblada con cocina a gas con conexión a lavadora y calefón 2 baños. Muy luminoso y con hermosas terminaciones recién remodelado está listo para ser habitado. Cuenta con cortinas tipo roller en todas las ventanas. Se encuentra en un cuarto piso. Gastos comunes de 25.000 no paga contribuciones y cuenta con estacionamiento de uso comunitario. a pasos de Unimarc de Villa Olímpica. Contactar a Carlos Rivera al fono 946739706 Vende Su Casa Gestión Inmobiliaria Precio Conversable"
"chile propiedades","Nunoa","TBD","Aparment","TBD","100 m²","3","2","TBD","Ñuñoa, Av. Irarrazaval / los cerezos/alcalde jorge monckeberg","https://chilepropiedades.cl/ver-publicacion/venta-usada/nunoa/departamento/av-irarrazaval-los-cerezosalcalde-jorge-monckeberg/2364932","www.procasa.cl Código:34089 MAURICIO PINO PROPIEDADES VENDE Amplio Departamento con ESTACIONAMIENTO Y BODEGA en excelente sector de Ñuñoa a pasos del Metro Villa Frei ubicado en un piso 16 con vista norte despejada. Cuenta con 3 dormitorios principal en suite con terraza 2 baños cocina equipada full electrica separada y con loggia. Living-comedor con terraza. Piso flotante y cerámico. Condominio con piscina quincho gimnasio sala de eventos estacionamientos de visita acceso controlado y conserje 24/7. Excelente conectividad a vías principales locomoción a la puerta a una cuadra de la estación de Metro Villa Frei. Cercano a colegios supermercados farmacias y gran variedad de comercios. Contribuciones $103.000.- Gastos comunes $100.000.-"
"chile propiedades","Nunoa","TBD","Aparment","TBD","100 m²","3","2","TBD","Ñuñoa, Holanda esquina Simón Bolívar, Ñuñoa","https://chilepropiedades.cl/ver-publicacion/venta-usada/nunoa/departamento/holanda-esquina-simon-bolivar-nunoa/3915085","Vendo VISTA CORDILLERA DESPEJADA FRENTE A UNA PLAZA sector muy tranquilo Impecable recién pintado piso flotante nuevo termo panel en todas las ventanas piso 3 cocina y logia tradicional remodelada con porcelanato en piso y paredes encimera y horno eléctrico depto. todo eléctrico 3 dormitorios 2 baños 1 estacionamiento y bodega amplia calefacción loza radiante Gastos comunes $100.000 base Edificio cuenta con jardín quincho terraza piscina gimnasio salón de computación muchos estacionamientos de visita. coordinar visita info@piren.cl o wsp +569 77524648"
"chile propiedades","Nunoa","TBD","Aparment","TBD","100 m²","3","2","TBD","Ñuñoa, Duble Almeyda/Eduardo Castillo Velasco","https://chilepropiedades.cl/ver-publicacion/venta-usada/nunoa/departamento/duble-almeydaeduardo-castillo-velasco/2879951","Vendo Hermoso amplio y cómodo departamento con una amplia terraza ubicado en un piso 1 cercano a Plaza Ñuñoa. Distribuido en 3 amplios dormitorios con closet 2 baños y cocina independiente con loggia. Sin Estacionamiento. Cuenta con excelente conectividad ideal para familia. Cercano a colegio Manuel de Salas restaurantes locales comerciales Mall Plaza Egaña y Portal Ñuñoa. A pasos del metro Chile España Avenida Irarrázabal y Macul bancos supermercados y centro médico. Contribuciones de 90.000 aproximadamente. Incluye bodega. Posibilidad de arrendar un puesto de estacionamiento. NO DEJE DE VISITARLO!!!"
"chile propiedades","Nunoa","TBD","Aparment","TBD","100 m²","3","2","TBD","Ñuñoa, Suecia/ Holanda","https://chilepropiedades.cl/ver-publicacion/venta-usada/nunoa/departamento/suecia-holanda/3742253","Departamento en venta en Ñuñoa. EXCELENTE OPORTUNIDAD en el mejor sector de Ñuñoa cercano a bancos comercios colegio campus oriente UC. Para visita coordinar con Waleska Baricic 569 9369 49 50. Mail: waleska@catabrochet.cl Hall de entrada 3 dormitorios 1 en suite con walk in closet 2 baños orientación Sur-oriente ventanas de aluminio calefacción central cocina con encimera horno eléctrico comedor de diario logia balcones cerrados piso flotante alarma circuito cerrado de televisión año 2009 1 estacionamiento 1 bodega El edificio cuenta con: Accesos controlados las 24 horas piscina sala multiuso sala de juegos lavandería quincho gimnasio."
"chile propiedades","Nunoa","TBD","Aparment","TBD","108 m²","3","2","TBD","Ñuñoa, Dublé Almeyda","https://chilepropiedades.cl/ver-publicacion/venta-usada/nunoa/departamento/duble-almeyda/3606934","Estupendo departamento ubicado en piso 2 sector Duble Almeyda 90/10 mts. Coordinar visitas con Cata +569 92757915 gerente@catabrochet.cl Hall de entrada living y comedor juntos con salida a la terraza 3 dormitorios (principal en suite) 2 baños cocina tradicional amoblada logia dormitorio y baño de servicio. Gasto comunes $ 160.000 Contribuciones $ 284.502 1 estacionamiento 1 bodega"
"chile propiedades","Nunoa","TBD","Aparment","TBD","120 m²","3","3","TBD","Ñuñoa, Luminoso y Amplio  Dpto. Cercano a Plaza Ñuñoa","https://chilepropiedades.cl/ver-publicacion/venta-usada/nunoa/departamento/luminoso-y-amplio-dpto-cercano-a-plaza-nunoa/3760560","Luminoso Dpto a pasos de Plaza Ñuñoa - 3 dormitorios principal en suite y walk in closet - 3 baños - Terraza - Piso flotante - Amplia cocina cerrada con comedor de diario y logia - 4 Dptos. Por piso - Orientación Oriente - 2 Estacionamientos - 1 Bodega El edificio cuenta con: - Piscina - Ascensores - Sala Multiuso con cocina - Gimnasio - Areas Verdes - Juegos para niños. www.InviertePropiedades.com Contacto Reservas y Más Información: www.inviertepropiedades.com/properties/luminoso-y-amplio-dpto-cercano-a-plaza-nunoa-nunoa-region-metropolitana Invierte Propiedades Código: 3003 Nombre del Ejecutivo: Nicole Teran Telefono Ejecutivo: 977795089"
"chile propiedades","Nunoa","TBD","Aparment","TBD","110 m²","3","2","TBD","Ñuñoa, Metro Villa Frei/Simon Bolivar/Diagonal Ote","https://chilepropiedades.cl/ver-publicacion/venta-usada/nunoa/departamento/metro-villa-freisimon-bolivardiagonal-ote/1984360","Procasa Araneda & Aguiar - Cod 28058) Amplio departamento de 3 dormitorios y 2 baños. Ubicado en tranquilo sector de calles arboladas con excelente conectividad al resto de la ciudad por avenidas Simon Bolivar Diagonal Oriente y Montenegro. Se distribuye en dormitorio principal con 1 baño en suite walk-in closet 2 dormitorios amplios 1 baño completo luminoso living-comedor junto cocina independiente loggia y terraza de vista despejada al Norte. Se vende con 1 estacionamiento en superficie y 1 bodega en subterráneo. Edificio con hermosas áreas verdes y en sus alrededores cuenta con destacados colegios supermercados restaurantes y comercios de barrio."
"chile propiedades","Nunoa","TBD","Aparment","TBD","140 m²","4","3","TBD","175.000.000 CLP","https://chilepropiedades.cl/ver-publicacion/venta-usada/nunoa/departamento/duble-almeyda-3260/2944779","Departamento duplex que consta en el primer piso de: -Living comedor separado -2 Dormitorios uno en suite. -2 baños -Cocina Amoblada -Loggia -Terraza Segundo piso: -Amplia sala de estar -2 dormitorios -1 baño Incluye 1 estacionamiento techado. Cerca de centros comerciales bancos farmacias locomoción colectiva y linea de metro 3 Chile España (a una cuadra)."
"chile propiedades","Nunoa","TBD","Aparment","TBD","100 m²","3","2","TBD","Ñuñoa, Suecia/ Holanda","https://chilepropiedades.cl/ver-publicacion/venta-usada/nunoa/departamento/suecia-holanda/3771304","Departamento en venta en Ñuñoa. EXCELENTE OPORTUNIDAD en el mejor sector de Ñuñoa cercano a bancos comercios colegio campus oriente UC. Para visita coordinar con Waleska Baricic 569 9369 49 50. Mail: waleska@catabrochet.cl Hall de entrada 3 dormitorios 1 en suite con walk in closet 2 baños orientación Sur-oriente ventanas de aluminio calefacción central cocina con encimera horno eléctrico comedor de diario logia balcones cerrados piso flotante alarma circuito cerrado de televisión año 2009 1 estacionamiento 1 bodega El edificio cuenta con: Accesos controlados las 24 horas piscina sala multiuso sala de juegos lavandería quincho gimnasio."
"chile propiedades","Nunoa","TBD","House","TBD","200 m²","3","1","TBD","140.000.000 CLP","https://chilepropiedades.cl/ver-publicacion/venta-usada/nunoa/casa/pichidangui-1903/3534976","Casa villa los alerces comuna de ñuñoa  construccion solida en ladrillo consta 3 habitaciones  1 baño  amplio living comedor  cocina  amplio patio  cercana a rodrigo de araya precio con respaldo tasacion bancaria"
"chile propiedades","Nunoa","TBD","House","TBD","180 m²","3","1","TBD","6.650,00 UF","https://chilepropiedades.cl/ver-publicacion/venta-usada/nunoa/casa/las-palmeras/3739142","Casa solida en pasaje seguro y cerrado con 3 dormitorios y 1 baño más una pieza independiente con baño (Cuarta pieza y Segundo baño) estacionamiento al costado de la casa para 2 vehículos y con mucho espacio disponible para remodelar. A 1 cuadra de mall Plaza Ñuñoa y 5 minutos de las líneas 3 y 6 del metro. Ideal para VIVIR o como INVERSION Para agendar visitas contactar a: Gestor Inmobiliario Sinarco Ltda. Manuel Muñoz Teléfono +56 9 9309 0199"
"chile propiedades","Nunoa","TBD","House","TBD","200 m²","3","2","TBD","180.000.000 CLP","https://chilepropiedades.cl/ver-publicacion/venta-usada/nunoa/casa/ramon-cruz-montteduardo-castillo-velasco/3743015","www.procasa.cl Ramon Cruz Montt / Eduardo Castillo Velasco. Casa ubicada en la comuna de ñuñoa a 6 minutos caminando de Centro nacional de entrenamiento olímpico 10 de Metro Los Orientas y a 12 de Metro Grecia cercano a colegios polideportivo centro cultural supermercados Homecenter restaurantes etc. Casa de un piso cuenta con 3 dormitorios y 2 baños living comedor juntos cocina independiente con una isla antejardin y patio trasero estacionamiento para dos autos. cuentan con cámaras de seguridad de la comunidad. Contribuciones $17.000 aprox."
"chile propiedades","Nunoa","TBD","House","TBD","204 m²","4","1","TBD","6.900,00 UF","https://chilepropiedades.cl/ver-publicacion/venta-usada/nunoa/casa/metro-estadio-nacionalav-greciapedro-de-valdiviadr-luis-bisquert/3687868","Procasa Araneda & Aguiar (COD-45768) - Excelente casa para remodelar emplazada en un buen barrio consolidado con buenas vías de acceso a 3 cuadras del Metro Estadio Nacional (L6) Cuenta con 80 m2. de construcción y 302 m2. de terreno. Se encuentra distribuida en 4 dormitorios 1 baño cocina independiente living y comedor separados amplio ante jardín y patio trasero. Estacionamiento para 6 autos. Buena oportunidad de inversión Contribuciones: $12.000."
"chile propiedades","Nunoa","TBD","House","TBD","250 m²","3","2","TBD","6.769,00 UF","https://chilepropiedades.cl/ver-publicacion/venta-usada/nunoa/casa/premio-nobeljose-pedro-alessandri/3155336","COD 42027/ Casa de 1 piso  a pasos del mall portal Ñuñoa Cuartel Pdi  supermercados. Con Antejardin y patio trasero . Cercana a futura linea 8 de metro Con 250 mt2 de terreno y 112 mt2 construidos ( metraje entregado por el dueño sujeto a confirmación ) . 3 dormitorios 2 baños  living comedor juntos  cocina independiente amoblada. Capacidad de 2 estacionamientos . No deje de visitar !"
"chile propiedades","Nunoa","TBD","House","TBD","110 m²","4","3","TBD","185.000.000 CLP","https://chilepropiedades.cl/ver-publicacion/venta-usada/nunoa/casa/simon-bolivarcampoamorholandachile-espana/3687849","Procasa Araneda & Aguiar (Cód 45733): Casa estilo alemán cercana a Plaza Ñuñoa y con excelente conectividad. Ubicada en pasaje cerrado y seguro. Posee 3 pisos distribuidos en 1er. Piso: living-comedor junto con piso flotante baño de visitas cocina independiente pieza y baño de servicio. - 2do. Piso: 2 dormitorios 2 baños (principal en suite). - 3er. Piso: 2 dormitorios amplios. Estacionamiento para 1 auto en superficie. La casa no cuenta con patio. Contribuciones 45.000. Contáctenos!"
"chile propiedades","Nunoa","TBD","House","TBD","180 m²","3","1","TBD","6.630,00 UF","https://chilepropiedades.cl/ver-publicacion/venta-usada/nunoa/casa/av-jose-pedro-alessandrilas-palmeras/3703302","www.procasa.cl Av. Jose Pedro Alessandri / Las Palmeras. Casa de un piso ubicada en la comuna de Ñuñoa a 3 minutos caminando de Portal Ñuñoa y Colegio República de Francia 5 minutos de UChile Campus Juan Gomez Millas y UMCE 15 minutos de Metro Estadio Nacional y 20 minutos de Metro Chile España y Plaza Ñuñoa cercano a comercio y locomoción. La casa esta ubicada en pasaje cerrado cuenta con living y comedor separado tres dormitorios y un baño cocina independiente y pieza se servicio completa logia patio y estacionamiento para dos autos por el costado. Pasaje no paga gasto común Contribuciones 39.000 aprox"
"chile propiedades","Nunoa","TBD","House","TBD","110 m²","4","3","TBD","180.000.000 CLP","https://chilepropiedades.cl/ver-publicacion/venta-usada/nunoa/casa/campoamor/2796590","CAMPOAMOR / Av. HOLANDAÑuñoa ÑUÑOA Se vende casa en condominio cerrado y seguro en excelente ubicación... Descripción: Casa de 3 pisos estilo alemán año de construcción 1973 orientación Nor-Oriente Primer Piso -Living-Comedor con piso flotante -Baño de Visita -Cocina Independiente con comedor de diario -Pieza y baño de servicio fuera del inmueble Segundo Piso -dormitorio principal en suite -1 dormitorio -1 baño completo Tercer Piso -2 dormitorios amplios de 6x3 aprox -1 Estacionamiento Contribuciones: $42.000 NO se paga gastos comunes Contactar a Carlos Rivera al teléfono 946739706 Vende SUCASA Gestión Inmobiliaria"
"chile propiedades","Nunoa","TBD","House","TBD","200 m²","3","1","TBD","200.000.000 CLP","https://chilepropiedades.cl/ver-publicacion/venta-usada/nunoa/casa/a-2-cuadras-metro-plaza-egana/3413622","Se vende casa de dos pisos en pasaje cerrado con excelente ubicación cerca de Plaza Egaña Estaciones de Metro Colegios y comercio ideal para familia. Descripción: Orientación Sur y patio con orientación Norte Año de construcción 1965 Primer Piso -Amplio Living-Comedor -Cocina ampliada y regularizada -Medio baño el cual hay que remodelar Segundo Piso -3 Amplios dormitorios cada uno con closet -1 Baño completo -No se pagan gastos comunes -Contribuciones $80.000 aprox Exterior -Amplio patio y un área techada que cuenta con una bodega y sala de juego o cuarto dormitorio -Estacionamiento para 2 vehículos Vende Su Casa Gestión Inmobiliaria Contactar a Carlos Rivera al fono 946739706"
"chile propiedades","Providencia","TBD","Aparment","TBD","110 m²","3","3","TBD","Providencia, Ramón Carnicer Santa Isabel","https://chilepropiedades.cl/ver-publicacion/venta-usada/providencia/departamento/ramon-carnicer-santa-isabel/3508103","Departamento de 110 mtrs NO TIENE ESTACIONAMIENTO NI BODEGA Primer piso Contactar a Yany Duarte 997756169 yany@vivaqui.com. Metro Parque Bustamante. Living comedor juntos cocina remodelada 3 dormitorios 3 baños Logia. Gastos Comunes $ 35.000 aprox"
"chile propiedades","Providencia","TBD","Aparment","TBD","103 m²","3","2","TBD","Providencia, Metro Santa Isabel - Vicuña Mackenna","https://chilepropiedades.cl/ver-publicacion/venta-usada/providencia/departamento/metro-santa-isabel-vicuna-mackenna/3922210","Departamento venta Providencia remodelado en 2 piso en edificio de 4 pisos de los años 40 espacios generosos buena conectividad movilización cercano a Metro Santa Isabel y próximo a Parque Bustamante. Coordinar visitas con Marisol +569 94892762 marisol@catabrochet.cl Amplios y cómodos recibos de concepto abierto con una cocina exquisita con estupenda península de madera muy equipada microondas con gril lavaplatos con secador encimera y campana nicho para refrigerador o lavadora o secadora. 3 dormitorios grandes con buenos closets y 2 baños completos con ventilación natural uno de ellos con espacio para lavadora o secadora. No tiene estacionamiento ni bodega. Gastos comunues de $ 17.000 para aseo y mantención de espacios comunes. Orientación sur igualmente recibe sol norte y poniente en diferentes áreas. Edificio con portero eléctrico solo 8 departamentos Caracteristicas del departamento: Altura de 270 mts. de piso a cielo Piso de parquet restaurado y vitrificado Porcelanato en cocina y baños Equipamiento nuevo Calefont nuevo Instalaciones de gas electricidad y de agua nuevas y en norma Citófono"
"chile propiedades","Providencia","TBD","Aparment","TBD","135 m²","4","3","TBD","6.975,00 UF","https://chilepropiedades.cl/ver-publicacion/venta-usada/providencia/departamento/providencia-metro-los-leones/2342527","Excelente ubicación estrategica en Providencia cercano a metro Los Leones bancos colegios centros comerciales restaurant A pasos de Mall Panoramico con excelente conectividad a autopistas. Hermoso departamento clásico muy silencioso e iluminado vista norte poniente y sur la propiedad cuenta con 135 metros cuadrados totales ubicada en un 4to piso amplios espacios con cocina amplia amoblada y equipada con encimera y horno empotrado cubierta granito logia amplia Cuenta con pasillo de distribución en donde se encuentran 3 amplios dormitorios todos con closet y 2 baños con tina de buen tamaño además de dormitorio y baño de servicio. Toda la propiedad cuenta con parquet vitrificado ceramico en baños y cocina. Cuenta con estacionamiento en superficie. Edificio sin ascensor solo 2 departamentos por piso. Bajos gastos comunes $100.000incluye agua fría VALOR UF. 6.975 No dude en contactarnos para agendar su visita excelente propiedad. ESCRIBANOS! Vende ACCIONA PROPIEDADES"
"chile propiedades","Providencia","TBD","Aparment","TBD","140 m²","3","3","TBD","Providencia, Pedro de Valdivia/Carlos Antúnez","https://chilepropiedades.cl/ver-publicacion/venta-usada/providencia/departamento/pedro-de-valdiviacarlos-antunez/3910503",".:PROCASA JORGE PABLO CARO PROPIEDADES:. Vende amplio departamento. Hermoso edificio de estilo arquitectónico moderno. Tercer piso con ascensor. Amplios ambientes distribuidos en 124 M2 interiores más una gran terraza de 16 M2 al lado del living comedor y de 3 amplios dormitorios 2 baños gran cocina con loggia y dormitorio y baño de servicios. Vista a grandes árboles hacia el poniente. Piso de parqué en todo el departamento en EXCELENTE ESTADO. Ubicado a pocas cuadras de Providencia acceso a bancos universidades centros médicos colegios servicios y comercio en general. Excelente acceso a locomoción colectiva. Líneas 1 y 6 del Metro Estaciones Pedro de Valdivia e Inés de Suárez."
"chile propiedades","Providencia","TBD","Aparment","TBD","100 m²","3","2","TBD","Providencia, Metro Santa Isabel","https://chilepropiedades.cl/ver-publicacion/venta-usada/providencia/departamento/metro-santa-isabel/3922232","Departamento en venta Providencia clásico exquisito en 2 piso luminoso remodelado muy amplio estupenda conectividad cercano a Metro Santa Isabel y Parque Bustamente. Coordinar visitas con Marisol +569 94892762 marisol@catabrochet.cl Hall de entrada living y comedor de gran espacio rica cocina integrada equipada con campana encimera a gas horno repisas y península de madera 3 dormitorios incluido dormitorio de servicio con baño en suite el dormitorio principal es de gran tamaño y tiene una acogedora terraza hacia patio interior. Uno de los baños tiene espacio para lavadora. No tiene estacionamiento ni bodega solo 3 departamento en el edificio. Características del departamento: Piso de parquet vitrificado Piso de porcelanato en cocina y baños Baños con ventilación natural No paga gastos comunes"
"chile propiedades","Providencia","TBD","Aparment","TBD","114 m²","3","3","TBD","Providencia, Chile España / Av. Holanda","https://chilepropiedades.cl/ver-publicacion/venta-usada/providencia/departamento/chile-espana-av-holanda/3693727","Amplio departamento remodelado de 104/10 mts. Orientación oriente a pocas cuadras de metro Chile-España (L3). Ubicado en tranquilo sector residencial cerca del Campus Oriente U. Católica supermercado Unimarc a 15 minutos caminando de Plaza Ñuñoa colegios bancos y variedad de comercio. Coordinar visitas con Mailen Carmona 569 6475 2020 mailen@catabrochet.cl 3 dormitorios y 3 baños (principal en suite) mas pieza de servicio piso vinilico calefacción por losa radiante. Cocina ampliada equipada con campana encimera a gas de 4 platos y horno conexión a lavadora. Living comedor con salida a cómoda terraza. 2 estacionamientos subterráneos 1 bodega Gastos comunes $ 180.000 Edificio del año 2006 de solo 8 pisos. Cuenta con seguridad las 24 hrs con accesos controlados piscina sala multiusos gimnasio bicicletero."
"chile propiedades","Providencia","TBD","Aparment","TBD","110 m²","3","3","TBD","Providencia, Parque Bustamante","https://chilepropiedades.cl/ver-publicacion/venta-usada/providencia/departamento/parque-bustamante/3504239","Departamento de 110 mtrs Primer piso Contactar a Yany Duarte 997756169 yany@vivaqui.com. Metro Parque Bustamante. Living comedor juntos cocina remodelada 3 dormitorios 3 baños Logia. NO TIENE ESTACIONAMIENTO NI BODEGA Gastos Comunes $ 35.000 aprox"
"chile propiedades","Providencia","TBD","Aparment","TBD","135 m²","4","2","TBD","Providencia, Diego de velasquez","https://chilepropiedades.cl/ver-publicacion/venta-usada/providencia/departamento/diego-de-velasquez/3505707","ID 28.205 EXCELENTE Departamento sector Providencia / Diego de Velásquez 4 PISO SIN ASCENSOR. Contactar a PATRICIA LILLO +569 51796821 / 222175555 mail: patricial@vivaqui.com Distribución: Hall de entrada amplio living y comedor con salida a terraza. Cocina tradicional equipada con loggia y despensa pieza de servicio. Cuatro dormitorios tres de ellos muy amplios. Todo el Depto. con parquet. Gastos comunes $ 85.000.- incluye agua potable. Recomiendo visitar."
"chile propiedades","Providencia","TBD","Aparment","TBD","120 m²","3","2","TBD","Providencia, Alfredo Lecannelier","https://chilepropiedades.cl/ver-publicacion/venta-usada/providencia/departamento/alfredo-lecannelier/3517007","CODIGO 9060 PATRICIA RAMOS SANTA LUCIA PROPIEDADES VENDE departamento Antiguo ubicado en providencia a solo pasos del metro Pedro de Valdivia cercano a comercios bancos restaurantes emplazado en una calle sin salida y una de las esquinas con mayor transito de personas de la comuna.El inmueble esta constituido por tres dormitorios de los cuales dos son amplios y uno con tamaño para cama de plaza y media cocina amplia y cerrada living comedor piso impecable de parquet se encuentra ubicado en el primer piso orientación Nor- Oriente.Es importante que sepas que es un edificio de solo tres pisos constituido por solo dos departamentos por piso.Es un lugar tranquilo con una ubicación inigualable lo que genera a tu favor una alta plusvalía.Una de las características potenciales del inmueble y mas relevantes es su AMPLITUD y es estilo de construcción francés que lo hace EXCLUSIVO en una ubicación en la que podrás disfrutar de una plusvalía asegurada a través del tiempo.Gastos comunes : 98.000 pesos.Edificio del año 1957 CON OPCIÓN A COMPRA SANTA LUCIA PROPIEDADES+56 9 83702878santaluciapropiedadessa@gmail.com"
"chile propiedades","Providencia","TBD","Aparment","TBD","117 m²","3","2","TBD","Providencia, Bilbao/Holanda","https://chilepropiedades.cl/ver-publicacion/venta-usada/providencia/departamento/bilbaoholanda/3623071","Departamento GRANDE año 1976 con remodelación en cocina ampliada y baños ventanas todas termopanel piso parquet en edificio de 4 pisos sin ascensor. Contacto Eugenia Bocchi 973371285 email eugeniab@vivaqui.com Distribución: Living - comedor amplio terraza 3 dormitorios todos buenos espacios el principal en suite 2 baños. Un estacionamiento para auto pequeño. Orientación: Nor Oriente Conserjería diurna. No hay estacionamiento de visitas. ID28516"
"chile propiedades","Providencia","TBD","Aparment","TBD","104 m²","4","3","TBD","6.900,00 UF","https://chilepropiedades.cl/ver-publicacion/venta-usada/providencia/departamento/calle-bustos-2363/3345801","Se vende gran departamento en buen estado de conservación en sector muy tranquilo y residencial de Providencia entre las avenidas Suecia y Los leones. Departamento con orientación suroriente a pasos de colegios y a tres cuadras de la estación de metro Inés de Suárez .cuenta con cuatro habitaciones y tres baños.Cocina equipada y amoblada cada habitación tiene closet ademas de contar con habitación de sevicio con baño incluído y logia . Edificio con accesos controlados y cámaras de vigilancia y conserjería 24 horas."
