Srce,Province,PublishedDate,PropertyType,PropertyState,MtTot,Bdroom,Bath,Parking,PriceUF,Link,Description
"chile propiedades","Las Condes","TBD","Aparment","TBD","114 m²","3","2","TBD","Las Condes, Marco Polo/ Monte Alegre","https://chilepropiedades.cl/ver-publicacion/venta-usada/las-condes/departamento/marco-polo-monte-alegre/3793301","Depatamento en venta en Las Condes Amplio y acogedor departamento en excelente ubicación a pasos del Metro Colón cercano a Colegio San Gabriel. Para visitas coordinar con Waleska Baricic al 569 9369 49 50. Mail waleska@catabrochet.cl 3 dormitorios con piso flotante 2 baños completos Living comedor con cerámica Ventanas con termopanel Logia y conexión a lavadora Superficie construida 104 m2 Superficie de terraza 10 m2 Orientación Oriente Tipo de gas cañería Tipo de calefacción caldera independiente Edificio del año 1992 Gastos Comunes $125.000.- Contribuciones $105.000.- 1 Estacionamiento y 1 bodega"
"chile propiedades","Las Condes","TBD","Aparment","TBD","100 m²","3","2","TBD","6.300,00 UF","https://chilepropiedades.cl/ver-publicacion/venta-usada/las-condes/departamento/condominio-residencial-curacoduqueco/3741066","departamento remozado cambio de cañeríasy grifería lavamanos wc tinas azulejos cerámicos piso flotante y ventanales de aluminio. El tercer dormitorio es pequeño puede ser usado como walked closet bodega interior (sin luz natural) malla de protección en todos los ventanales. Focos de las luces incluidos también nuevos. El condominio cuenta con amplias zonas de juego gimnasio exterior locales comerciales al interior biblioteca talleres como yoga baile entretenido etc. Guardias y conserjes 24/7. Cuenta con estacionamientos de visita exteriores."
"chile propiedades","Las Condes","TBD","Aparment","TBD","100 m²","3","2","TBD","Las Condes, Sebastián Elcano / Colón","https://chilepropiedades.cl/ver-publicacion/venta-usada/las-condes/departamento/sebastian-elcano-colon/2810863","Amplio departamento seguro y muy tranquilo inmejorable ubicación excelente conectividad en sector consolidado de la comuna CARACTERÍSTICAS - 100/105 m2 - 3 Dormitorios 1 en suite - 2 Baños - Living comedor juntos con salida a terraza - Cocina amoblada - Logia OTROS - Piso 2 - Gastos comunes $70.000 aprox. - Nor- Oriente - Sin Bodega - Sin estacionamiento CARACTERÍSTICAS DEL EDIFICIO Edificio cuenta con amplios jardines y áreas verdes emplazado en sector muy residencial de la comuna y muy cercano a colegios farmacias y comercio. Conserje 24/7. Estacionamiento de visitas."
"chile propiedades","Las Condes","TBD","Aparment","TBD","111 m²","4","3","TBD","125 CLP","https://chilepropiedades.cl/ver-publicacion/venta-usada/las-condes/departamento/vaticano-3946/3769473","nan"
"chile propiedades","Las Condes","TBD","Aparment","TBD","114 m²","3","2","TBD","Las Condes, Marco Polo/ Monte Alegre","https://chilepropiedades.cl/ver-publicacion/venta-usada/las-condes/departamento/marco-polo-monte-alegre/3420602","Departamento en venta en Las Condes. Amplio y acogedor departamento en excelente ubicación a pasos del Metro Colón cercano a Colegio San Gabriel. Para visitas coordinar con Waleska Baricic al 569 9369 49 50. Mail waleska@catabrochet.cl 3 dormitorios con piso flotante 2 baños Living comedor con cerámica Ventanas con termopanel Logia y conexión a lavadora Superficie construida 104 m2 Superficie de terraza 10 m2 Orientación Oriente Tipo de gas cañería Tipo de calefacción caldera Edificio del año 1992 Gastos Comunes $125.000.- Contribuciones $105.000.- 1 Estacionamiento y 1 bodega"
"chile propiedades","Las Condes","TBD","House","TBD","144 m²","4","2","TBD","160.000.000 CLP","https://chilepropiedades.cl/ver-publicacion/venta-usada/las-condes/casa/paul-harris-vital-apoquindo/3505677","Casa con ampliaciones SOLO CONTADO Sector Vital Apoquindo Paul Harris Pequeño antejardin con dos estacionamientos techados Living comedor juntos baño cocina buen tamaño patio con bodega. sótano acústico para músicos 2 piso liviano 4 dormitorios baño completo con luz natural. ....Contactar a Yany Duarte yany@vivaqui.com 997756160"
