Srce,Province,PublishedDate,PropertyType,PropertyState,MtTot,Bdroom,Bath,Parking,PriceUF,Link,Description
"chile propiedades","Santiago","TBD","Aparment","TBD","100 m²","3","2","TBD","100.000 CLP","https://chilepropiedades.cl/ver-publicacion/venta-usada/santiago/departamento/metro-chile-espana-3d2b-100m2/2851002","Ubicado en excelente sector de Ñuñoa barrio residencial familiar Exequiel Fernandez / Juan Gomez Millas a pocas cuadras de METRO Chile España cercano a comercios Mall Portal Ñuñoa Supermercado Jumbo y Lider colegios de excelencia como San Gaspar colegio Suizo y Divina Pastora excelente conectividad. Departamento con terminaciones de primera calidad año 2010 con buenas mantenciones se encuentra en excelentes condiciones orientación Nor-Oriente en piso 13 con hermosa vista panorámica superficie total 100mts2 aprox. Se distribuye en: - Cómodo hall de entrada - Amplio living comedor con salida a terraza en L con aire acondicionado - Cocina amoblada y equipada con logia amplia - 3 dormitorios todos de buen tamaño con closet - 2 baños ambos con tina uno de ellos en suite Terminaciones y equipamiento: Cuenta con aire acondicionado alarma muy buena distribución piso laminado en dormitorios living comedor y hall Cocina con porcelanato. Incluye ESTACIONAMIENTO y BODEGA. Gastos comunes: $95.000 más consumo de agua caliente Espacios comunes: El edificio es de ambiente familiar tranquilo. Entre las áreas comunes destacan gimnasio equipado salas multiuso quincho piscina lavandería y gran cantidad de estacionamientos de visita. Interesados ESCRIBIR mediante este portal o vía correo electrónico o whatsapp +56950198675 y responderemos sus consultas a la brevedad. Vende ACCIONA PROPIEDADES"
"chile propiedades","Santiago","TBD","Aparment","TBD","105 m²","4","3","TBD","Santiago, Beaucheff, Club Hìpico","https://chilepropiedades.cl/ver-publicacion/venta-usada/santiago/departamento/beaucheff-club-hipico/3074057","Departamento con espacios amplios vista despejada cercano a Universidad de Chile Beaucheff Colegio don Bosco sagrado corazón de Jesús metro Rondizzoni parque O" Higgins y locomoción colectiva. CARACTERÍSTICAS 93 / 105 m2 aprox 4 dormitorios (uno en suite) 3 baños Living comedor juntos Cocina amoblada con comedor diario y logia 1 estacionamiento 1 bodega OTROS Piso 9 Orientación nor poniente Gastos Comunes 120.000 aprox CARACTERÍSTICAS DEL EDIFICIO Edificio de año 2004 de 13 pisos equipado con 2 ascensores juegos de niños gimnasio sala de evento lavandería piscina conserjería las 24 horas"
"chile propiedades","Santiago","TBD","Aparment","TBD","135 m²","3","2","TBD","152.000.000 CLP","https://chilepropiedades.cl/ver-publicacion/venta-usada/santiago/departamento/santa-isabel/3769205","Amplio Depto. con 3D + 2B y Terraza. A 3 cuadras del Metro Santa Isabel. Código Interno: StgoC_216 Amplio Departamento con 3 dormitorios (principal en suite) 2 baños y terraza. 65 m2 útiles / 135 m2 totales. Posee una amplia terraza con salida en el living-comedor y por dormitorio principal. Piso 14. Orientación Sur-Oriente. Cocina americana cubierta de melanina equipada con: encimera a gas horno eléctrico y campana. Posee conexión para lavadora. Piso flotante en el living-comedor y dormitorios; cerámica en baños y cocina; baldosa en terraza. Posee estacionamiento. Edificio de 24 pisos cuenta con: áreas verdes juegos para niños sala multiuso sala de reuniones gimnasio piscina quincho seguridad 24 horas 4 ascensores lavandería y estacionamiento de visitas. Excelente ubicación y conectividad a 3 cuadras del Metro Santa Isabel. Todos los servicios cerca: A pasos del Transantiago supermercados Universidades Comercio Farmacias Colegios Bancos gimnasios y todo tipo de servicios. Calles cercanas: Avenida Portugal Santa Isabel Vicuña Mackenna. Gastos comunes: $115.000. aprox. Incluye agua caliente. Para más información ver: http://www.corredorpro.cl/listing/amplio-depto-con-3d-2b-y-terraza-a-3-cuadras-del-metro-santa-isabel/ Para una mejor atención en su consulta favor indicar código interno de propiedad: StgoC_216  y si desea agendar visita agregar alternativas de días y horarios disponibles. Convenios con Instituciones Financieras para otorgamiento de Crédito Hipotecario. Para mayor información dirigirse a http://www.corredorpro.cl o contáctenos al mail: contacto@corredorpro.cl o al teléfono: 981575750."
"chile propiedades","Santiago","TBD","Aparment","TBD","121 m²","4","2","TBD","6.450,00 UF","https://chilepropiedades.cl/ver-publicacion/venta-usada/santiago/departamento/duble-almeyda-2020/3666331","OPORTUNIDAD ÚNICA !!! Excelente departamento en venta en Ñuñoa. Sector residencial con excelente conectividad. Excelente ubicación. Se ubica en 2do. piso con orientación Sur-Oriente. Consta de 4 dormitorios 2 baños cocina amoblada de espacio abierto con Isla y loggia. 2 terrazas. Estacionamiento y bodega. Condominio cuenta con piscina sala de gimnasio etc."
"chile propiedades","Santiago","TBD","Aparment","TBD","No","3","2","TBD","150.000.000 CLP","https://chilepropiedades.cl/ver-publicacion/venta-usada/santiago/departamento/santiago-region-metropolitana/3642268","Se vende amplio departamento ubicado en pleno Santiago Centro. Cuenta con 3 dormitorios 2 baños estacionamiento incluido. Excelente ubicación cercano a universidades colegios bancos supermercados cercano a la estación del metro Moneda y Universidad de Chile Agenda tu visita: Corredora Palma Fuentes SPA +56 9 7513 7656 +56 9 8294 0637 +56 9 7899 3023 Contacto@corredorapalmafuentes.cl www.corredorapalmafuentes.cl #departamento #santiagocentro #santiago #compraventa #corredorapalmafuentes #compraventa #propiedad #inmobiliaria #chile #metromoneda #metroudechile"
"chile propiedades","Santiago","TBD","Aparment","TBD","109 m²","4","3","TBD","180.000.000 CLP","https://chilepropiedades.cl/ver-publicacion/venta-usada/santiago/departamento/roman-diaz-785/3520129","Acogedor departamento en cuarto piso orientación sur oriente. Cuenta con una distribución funcional en 109m2 en buen estado de conservación. Su programa está compuesto por amplio living comedor cocina independiente amoblada y equipada 4 dormitorios tres baños logia amplio balcón cerrado estacionamiento y bodega. En sus terminaciones destacan piso flotante y alfombrado muros cerámicos y papel mural pintura puertas en madera y cielos en pintura. El condominio cuenta con control de acceso 24 horas y sistema de vigilancia por cámaras de seguridad para accesos Se encuentra emplazado en barrio residencial de la comuna de Providencia. Cuenta con todo tipo de equipamientos que junto con entregarle gran plusvalía al inmueble benefician positivamente la calidad de vida de quienes habitan en él dentro de los cuales destacan comercio strip center supermercados centros educacionales y deportivos gastronómicos de entretenimiento instituciones financieras establecimientos médicos hospitales clínicas y áreas verdes y seguridad ciudadana entre otros. Adicionalmente cuenta con gran conectividad tanto mediante transporte público cercano a estaciones de metro Salvador contando con recorridos de Transantiago como por sus accesos viales principales destacando Av. Eliodoro Yáñez Av. Francisco Bilbao Av. Salvado Conocemos lo importante que es este proceso y queremos que disfrutes tranquilamente tu propiedad. Te acompañamos y colaboramos contigo a lo largo de él facilitando tu compra para que se realice sin contratiempos y en el menor tiempo posible."
"chile propiedades","Santiago","TBD","Aparment","TBD","100 m²","3","2","TBD","6.077,00 UF","https://chilepropiedades.cl/ver-publicacion/venta-usada/santiago/departamento/cristobal-colon-3770/2063268","único precio!!! departamento recién remodelado a 2 cuadras metro colon Características: - 3 dormitorios - 2 baños - piso 7 - 100 mts2 totales - piso flotante - cocina amoblada - piso flotante - gastos comunes : 100.000 Contribuciones: 95.000 - nor - poniente Areas comunes: - cámaras de seguridad - accesos controlados - conserjes 24 hrs - estacionamientos de visitas - areas verdes - año edificio 1995 única oportunidad de venta por viaje !!!! a solo dos cuadras metro colon ubicación privilegiada sector de las condes cercano a supermercado jumbo mini-market estaciones de servicio colegio verbo divino villa maria restorant farmacias areas verdes y precio insuperable !!!"
"chile propiedades","Santiago","TBD","Aparment","TBD","140 m²","4","3","TBD","5.300,00 UF","https://chilepropiedades.cl/ver-publicacion/venta-usada/santiago/departamento/avenida-jose-pedro-alessandri/3627468","Hermoso departamento en primer piso con amplio patio privado ubicado en condominio con áreas verdes comunes y seguridad 24/7. 4 dormitorios 3 baños cocina amoblada estacionamiento. Cercano a colegios universidades supermercados y mall. Buena conectividad. Futura estación de Metro. Vende dueño sin comisión."
"chile propiedades","Santiago","TBD","Aparment","TBD","113 m²","3","3","TBD","6.350,00 UF","https://chilepropiedades.cl/ver-publicacion/venta-usada/santiago/departamento/santo-domingo-1457/3921977","Moderno departamento DANACORP ubicado en calle Santo Domingo entre Amunátegui y San Martín cerca metro Santa Ana y emplazado en el centro histórico de Santiago cercano a universidades colegios hospitales bancos malls servicios en general. Excelente conectividad a Autopista central norte-sur Costanera norte Aeropuerto V Región etc. Departamento de 113.3 m2 totales con alarma gran terraza cerrada con acceso desde living y dormitorio principal cocina tradicional amoblada equipada y comedor de diario muebles más mesón adicionales todas las cubiertas de granito logia independiente con lavadero. Dormitorio principal en suite con walk-in closet 2 amplios dormitorios con closets con puertas abatibles 2 baños completos y 1 de visitas los 3 baños con cubierta de mármol. Living comedor y dormitorios con piso fotolaminado. Porcelanato en hall de acceso sala de estar cocina y baño de visitas. Puerta para separación de ambientes. Orientación nor-oriente con hermosa vista a jardines interiores cercanos. Incluye bodega grande y estacionamiento juntos en subterráneo. Edificio saneado bajo administración externa según ley de copropiedad."
"chile propiedades","Santiago","TBD","House","TBD","204 m²","5","3","TBD","Santiago, Rosas 2376","https://chilepropiedades.cl/ver-publicacion/venta-usada/santiago/casa/rosas-2376/3921677","Se vende propiedad ideal para; culto religioso eventos uso comercial y con algunos ajustes para uso habitacional. Su ubicación es privilegiada a 3 cuadras de metro cumming a 1 cuadra de la locomoción supermercados colegios y centro de salud cercanos. La propiedad es de material sólido cuenta con 1 sala principal 2 salas auxiliares 2 baños ( varones y damas) patio de luz un segundo piso no dormitorio baño y cocina. Se encuentra en excelente estado lista para uso sin problemas. La venta es sin comisión la realiza directamente su dueño se aceptan ofertas razonables. Interesados contactar a: Patricio Rodríguez +56984163424 patricio.rodriguezm@icloud.com Elizabeth Muñoz +56991343955 elisovino@gmail.com"
"chile propiedades","Santiago","TBD","House","TBD","200 m²","3","3","TBD","Santiago, Calle Sánchez Fontecilla","https://chilepropiedades.cl/ver-publicacion/venta-usada/santiago/casa/calle-sanchez-fontecilla/3738766","Acogedora casa en sector residencial Sánchez Fontecilla  comuna Puente Alto Características: 3 dormitorios 3 baños cocina amoblada Living - comedor Loggia Estacionamiento Cerca del Mall Tobalaba  locomoción colectiva colegiossupermercados centros de salud y servicios de todo tipo. Vende N&G Corredora de propiedades Contáctanos : (+569)59043816"
"chile propiedades","Santiago","TBD","House","TBD","232 m²","4","2","TBD","Santiago, Los Sauces 4938","https://chilepropiedades.cl/ver-publicacion/venta-usada/santiago/casa/los-sauces-4938/3928305","Vende excelente propiedad con acceso para silla de ruedas y lista para su uso sin problemas ideal para culto religioso/eventos/uso comercial con algunos ajustes para uso habitacional. La propiedad está ubicada en calle Los Sauces N° 4938 comuna de Quinta Normal orientación N/S con 320 m2 de terrero y 232 m2 construidos en material sólido. Cuenta con 4 dependencias: 1 sala principal; tres salas auxiliares conectadas a sala principal; Hall de acceso 2 baños (varones y damas) defensas en las ventadas y puertas; alarma. Ubicación privilegiada cerca de paradero de locomoción supermercado hospital colegios farmacia etc. Venta la realiza directamente su dueño se aceptan ofertas razonables."
"chile propiedades","Santiago","TBD","House","TBD","150 m²","4","3","TBD","136.500.000 CLP","https://chilepropiedades.cl/ver-publicacion/venta-usada/santiago/casa/mar-infinito/3452704","​EXCELENTE PROPIEDAD EN VENTA. Cumbres Blancas -Pudahuel. Excelente sector barrio cerrado. Propiedad en excelente estado de conservación ampliada. Su distribución consta de 2 pisos. En primer nivel cuenta con living - comedor separados sala de estar baño de visitas dormitorio principal en suite amplia cocina completamente amoblada y equipada con horno eléctrico encimera y campana. Comedor de diario y loggia. Su segundo nivel consta de 3 dormitorios un baño sala de estar y entre-techo habilitado con escalera luz y piso para uso de bodega. En su exterior consta de un patio trasero y estacionamiento cubierto para 2 vehículos. La casa se ubica en esquina dando un factor de privacidad y mayor espacio exterior. En frente de la casa cuenta con plaza y juegos infantiles. Sector de fácil acceso y cercano a comercio locomoción y autopistas urbanas."
"chile propiedades","Santiago","TBD","House","TBD","124 m²","6","1","TBD","4.629,00 UF","https://chilepropiedades.cl/ver-publicacion/venta-usada/santiago/casa/portugalvictoria/3509039","OPORTUNIDAD: CASA ANTIGUA DESOCUPADA PARA REMODELAR CON RECEPCIÓN FINAL DESTINO USO COMERCIAL en barrio industrial comercial y profesional apta para Oficinas Bodegas Empresa y/o Taller a 2 cuadras de Avda. Matta y Vicuña Mackenna . Próxima a Bancos Colegios Comercio Proyectos inmobiliarios y a 15 Minutos centro de Santiago. Metro Lineas 5 y 6. Contactar a email eugeniab@vivaqui.com +56 9 73371285/ 222175555 DESCRIPCIÓN:: 6 privados buen tamaño 1 baño cocina bodegas alarma. Habilitada para corriente trifásica conexiones instaladas para hacer un segundo baño. Superficie 130 metros aprox. construidos. en 2 pisos. Exenta de Contribuciones. NO tiene estacionamiento. ID28245"
"chile propiedades","Santiago","TBD","House","TBD","155.000.000 CLP","4","3","TBD","3321360","https://chilepropiedades.cl/ver-publicacion/venta-usada/santiago/casa/andes-2099/3321360","Propiedad Casa Esquina en venta con Local Comercial. 150 metros cuadrados construidos. La propiedad consta de dos pisos. Dos entradas independientes. Local Comercial ideal para Minimarket Servicios Peluquería etc. Cuenta con Rol Comercial y Corriente Trifásica. Excelente ubicación y conectividad acceso directo a supermercados bancos colegios restaurant comercio y servicios. A pasos de Barrio Brasil y Barrio Yungay. Cercano a Parque Los Reyes. Excelente oportunidad para inversionistas o personas que proyecten la construcción de locales comerciales en la zona o viviendas para arriendo habitacional. La propiedad es ideal para la construcción de locales comerciales en la primera planta y vivienda en el segundo nivel."
"chile propiedades","Santiago","TBD","House","TBD","100 m²","3","2","TBD","148.000.000 CLP","https://chilepropiedades.cl/ver-publicacion/venta-usada/santiago/casa/portalescueto/2703733","ww.procasa.cl Ricardo Vial Ltda. (La Gloria) Un oasis en pleno centro de Santiago Casa en condominio frente al Parque Portales. Casa tipo Townhouse de 3 pisos 1 piso living comedor cocina terraza 2 piso 2 habitaciones baño 3 piso dormitorio principal baño y terraza 1 estacionamiento. No tiene gastos comunes Contribuciones 50.000 Colegios San Ignacio Sagrado Corazón de alameda Pedro de Valdivia Supermercado Líder express sta Isabel tottus A pasos del metro unión latinoamericana y Cumming. Ideal para familia"
"chile propiedades","Santiago","TBD","House","TBD","196 m²","4","3","TBD","160.000.000 CLP","https://chilepropiedades.cl/ver-publicacion/venta-usada/santiago/casa/maipu/3920661","Espectacular casa "Nueva" de 196 m2 con 136 m2 construidos El diseño es moderno tipo mediterráneo cuenta con una gran cocina completa amplio salón de estar 3 baños con ducha (1 abajo 2 arriba) el principal cuenta con Jacuzzi 4 dormitorios (Uno abajo 3 arriba) amplios closets cuenta con un gran patio que podría albergar varios autos y piscina grande. Existe mucha flexibilidad de redefinir el uso de algunos espacios según las necesidades. Exterior: Un gran patio con harto pasto en un sector y otra parte de patio con cerámicas con cobertizo. Observaciones: La casa se hizo de nuevo el año 2019 se botó entera la casa vieja y se realizó todo de nuevo cumpliendo con todas las normativas y permisos de un proyecto de esta envergadura está ubicada en un pasaje interior con amplios pasajes sin vista a vecinos frente a una plaza con gran espacio exterior para estacionar bastantes autos pasaje antiguo amplios pasajes muy tranquilo a pasos de Avenida Carmen con Portales (La mejor ubicación de transportes en Maipú)a pasos del Templo Votivo a pasos de la Plaza de Maipú todos sus papeles y regulaciones al día se vende por viaje al extranjero."
"chile propiedades","Santiago","TBD","House","TBD","240 m²","4","4","TBD","180.000.000 CLP","https://chilepropiedades.cl/ver-publicacion/venta-usada/santiago/casa/canal-de-la-luz-5023/2673595","Linda y cómoda casa de 3 pisos en La Dehesa de La Viña ubicada en lugar privilegiado entorno natural muchas areas verdes lejos del ruido de la ciudad y con una gran vista. VALOR INDICADO .... CONVERSABLE"
"chile propiedades","Santiago","TBD","House","TBD","290 m²","4","4","TBD","180.000.000 CLP","https://chilepropiedades.cl/ver-publicacion/venta-usada/santiago/casa/pje-el-alcanfor-8626/3747227","Propiedad muy cómoda amplia ubicada en muy buen sector de La Florida cercana a centros comerciales supermercados colegios y áreas verdes. Consta de living comedor independiente cocina amoblada y equipada con comedor de diario baño de visitas 4 dormitorios 2 en suite. Piso flotante y cerámica. Tiene 2 Calefont El patio con cerámica y terraza techada. Estacionamiento techado."
"chile propiedades","Santiago","TBD","House","TBD","363 m²","3","2","TBD","5.690,00 UF","https://chilepropiedades.cl/ver-publicacion/venta-usada/santiago/casa/condominio-las-brisas-norte-chicureo/2906797","¡¡¡GRAN REBAJA Y OPORTUNIDAD!!! SE VENDE HERMOSA CASA AISLADA CONDOMINIO LOS DIAGUITAS “PARQUE BRISAS NORTE DE CHICUREO” accesos controlados 24/7 3 Dormitorios y 2 Baños Sala de Estar Cocina full equipada y logia terraza quincho Excelente conectividad (AUTOPISTA LOS LIBERTADORES) privacidad y tranquilidad cerca de supermercados centros comerciales colegios jardines infantiles y mall. Metros Cuadrados Metros Construidos: 114 metros ^2. Metros Terreno: 363 metros ^2. Terminaciones Piso baños: Cerámicos. Piso Living - Comedor: Piso Flotante. Dormitorios: Porcelanato y Alfombra. Características propiedad Casa en excelente estado y mantención hermosa y gran terraza techada con quincho incluido piscina 3x7 logia persianas metálicas solo frontis casa 2 estacionamiento dormitorio matrimonial en suite y aire acondicionado portón eléctrico jardines formados riego automático y maravillosa pérgola de madera. Otros suministros internet teléfono tv cable wi-fi Gastos Comunes $ 50.000 Contribuciones $ 70.000. Precio: UF 5.690.- www.lodgepropiedades.cl Contáctanos: Paulina Montt: +569 96761295. Carlos Miranda: +569 75894834. Email:contacto@lodgepropiedades.cl"
"chile propiedades","Santiago","TBD","House","TBD","168 m²","3","3","TBD","130.000.000 CLP","https://chilepropiedades.cl/ver-publicacion/venta-usada/santiago/casa/plaza-magna/3345143","Se vende espectacular casa en condominio Plaza Magna  a pasos del metro las mercedes cercana a centro comerciales supermercado colegios jardines infantiles locomoción colectiva y áreas verdes . Característica: 3 Dormitorios principal en suite 3 Baños cocinas Living-comedor Sala de estar Loggia Quincho CONTACTAR : contacto@villenfuentealba.cl"
"chile propiedades","Santiago","TBD","House","TBD","200 m²","6","2","TBD","Santiago, San Pablo & Maipú","https://chilepropiedades.cl/ver-publicacion/venta-usada/santiago/casa/san-pablo-maipu/3116066","Oportunidad única. se vende propiedad con potencial comercial ubicada en san pablo/ maipú a pasos de metro quinta normal contando con alto flujo peatonal y vehicular. Actualmente Se encuentra arrendada en $900.000 Propiedad apta para local comercial o bodega."
"chile propiedades","Santiago","TBD","House","TBD","200 m²","6","2","TBD","Santiago, Barrio Yungay","https://chilepropiedades.cl/ver-publicacion/venta-usada/santiago/casa/barrio-yungay/3656882","Oportunidad Única. Inmueble habitacional con potencial comercial ubicado en calle Maipú a pasos de avenida San Pablo cercana a Metro Quinta Normal L5. Cuenta con alto flujo peatonal y vehicular. Actualmente se encuentra con destino habitacional y arrendada en $900.000 por mes. Propiedad apta para local comercial o bodega. Cercana a Barrio Yungay servicios y equipamiento de todo tipo comercio bancos restoranes colegios universidad transporte parque Quinta Normal. Buena accesibilidad a través de Matucana o San Pablo. Propiedad cuenta con 6 dormitorios y 2 baños. (Ver distribución en la última foto). (Servicio de Gestión de corretaje 2% + IVA)"
"chile propiedades","Santiago","TBD","House","TBD","345 m²","4","4","TBD","6.350,00 UF","https://chilepropiedades.cl/ver-publicacion/venta-usada/santiago/casa/transversal-uno/3490777","PROPIEDAD EN VENTA CIUDAD DE LOS VALLES-PUDAHUEL. Barrio cerrado. ¡¡Un concepto de casa diferente en desniveles le hace proyectar un cómodo y acogedor ambiente!! La distribución de la casa consta de lo siguiente: PRIMER NIVEL: Hall de entrada baño de visitas amplio living y dormitorio principal en suite. SEGUNDO NIVEL: Comedor cocina amoblada y comedor de diario. Logia y dormitorio de servicio completo. Amplia terraza exterior. TERCER NIVEL: 2 dormitorios con closet baño completo y sala de estar con terraza que da vista al valle . Su terreno cuenta una amplia terraza en su parte posterior amplio ante-jardín riego automático variedad de frutales portón automático y estacionamiento para 2 o 3 vehículos. Una excelente alternativa para vivir en un sector tranquilo y de buena conectividad vial. Completo sector comercial cercano colegios iglesia club deportivo etc."
"chile propiedades","Santiago","TBD","House","TBD","129 m²","4","3","TBD","115.000.000 CLP","https://chilepropiedades.cl/ver-publicacion/venta-usada/santiago/casa/plaza-magna/3540714","Hermosa casa muy cerca del metro las mercedes  condominio frente Ciudad de Sol San Carlos Puente Alto 4 dormitorios 3 baños Cocina equipada Logia Amplio comedor y living Estacionamiento 1 vehículos Bodega Quincho con horno Ubicada en pasaje amplio con acceso restringido ( portón eléctrico) Cercana a Vicuña Mackenna plazuela independencia centro de estudios DUOC supermercados restaurant outlett metro colegios excelente ubicación. Vende N&G Propiedades (+569)59043816 Natalia Arenas"
"chile propiedades","Santiago","TBD","House","TBD","320 m²","3","2","TBD","6.000,00 UF","https://chilepropiedades.cl/ver-publicacion/venta-usada/santiago/casa/avenida-santa-rosa/3591099","¡¡¡FERRADA&VIAL PROPIEDADES!!! ¡INVIERTE YA! Excelente Propiedad + locales comerciales en San Joaquín La propiedad actualmente funciona con dos locales comerciales y la vivienda en la parte posterior con acceso por pasaje lateral. Cercana a vías importantes dentro de la comuna de San Joaquín como Avenida Santa Rosa Lo Ovalle y Las Industrias. La casa consta de 11888 m2 de construidos y 320 m2 de terreno 3 dormitorios 2 baños. Cocina semi amoblada living comedor loggia Características: 188 m2 de construidos 320 m2 de terreno 3 dormitorios 2 baños Living comedor Cocina Loggia Amplio Patio Con una ubicación privilegiada: -En avenida principal. -Gran tránsito de personas. -En esquina panorámica (incrementa la visibilidad del local). VALOR UF 6390 más 2% por comisión de corretaje + IVA Contactar a: Fono: ☎️+56 2 29295342 / 📲+ 56 9 34262150 Equipo FERRADA&VIAL Propiedades 📧 contacto@ferradayvial.cl"
"chile propiedades","Santiago","TBD","House","TBD","194 m²","3","3","TBD","125.000.000 CLP","https://chilepropiedades.cl/ver-publicacion/venta-usada/santiago/casa/la-montana-sur-3650/3914648","Mundo propiedades Chile vende hermosa casa ubicada en el condominio la Montaña. El condominio en el que se encuentra la propiedad además posee una laguna artificial navegable y 3 piscinas. Casa de 2 pisos distribuida de la siguiente manera: Primer nivel: Living comedor cocina completamente amoblada y equipada con encimera y horno eléctrico baño de visitas sala de estar loggia quincho y patio. Dormitorio principal con baño en suite sauna y jacuzzi. Segundo Piso: 2 dormitorios 2 baños Todas las ventanas de la casa son de PVC con termopanel el piso es flotante y cerámico. Gasto común 120.000.- aproximadamente El condominio cuenta con Club House estacionamiento de visitas gimnasio piscina pérgola portón automático quincho sala Multiuso jardín posterior riego automático. Valor: $125.000.000.- Superficie total: 194 m² Superficie construida: 198m² Dormitorios: 3 Baños: 3 Estacionamiento: 2 Si deseas visitar la propiedad no dudes en llamar Sandra Jara Carrasco Gestión Inmobiliaria y Legal. Mundo propiedades Chile Cel. +569/42289569"
